[
  {
    "id": "earthquake",
    "name": "じしん",
    "type": "じめん",
    "category": "物理",
    "power": 100,
    "accuracy": 100,
    "pp": 10,
    "additional_effect": null,
    "effect_chance": null,
    "priority": 0,
    "makes_contact": false,
    "boosts_own_stat": null
  },
  {
    "id": "dragon_dance",
    "name": "りゅうのまい",
    "type": "ドラゴン",
    "category": "変化",
    "power": null,
    "accuracy": null,
    "pp": 20,
    "additional_effect": "自分の攻撃と素早さを1段階上げる",
    "effect_chance": null,
    "priority": 0,
    "makes_contact": false,
    "boosts_own_stat": { "stat": "attack", "stages": 1 }
  },
  {
    "id": "draco_meteor",
    "name": "りゅうせいぐん",
    "type": "ドラゴン",
    "category": "特殊",
    "power": 130,
    "accuracy": 90,
    "pp": 5,
    "additional_effect": "使用後、自分の特攻が2段階下がる",
    "effect_chance": 100,
    "priority": 0,
    "makes_contact": false,
    "boosts_own_stat": null
  },
  {
    "id": "fire_blast",
    "name": "だいもんじ",
    "type": "ほのお",
    "category": "特殊",
    "power": 110,
    "accuracy": 85,
    "pp": 5,
    "additional_effect": "10%の確率で相手を火傷状態にする",
    "effect_chance": 10,
    "priority": 0,
    "makes_contact": false,
    "boosts_own_stat": null
  },
  {
    "id": "solar_beam",
    "name": "ソーラービーム",
    "type": "くさ",
    "category": "特殊",
    "power": 120,
    "accuracy": 100,
    "pp": 10,
    "additional_effect": "通常2ターン技。晴れの場合は1ターンで発動",
    "effect_chance": null,
    "priority": 0,
    "makes_contact": false,
    "boosts_own_stat": null
  }
]
